{
  "$schema": "http://json-schema.org/draft-07/schema#",
  "title": "Online Retail Order",
  "type": "object",
  "properties": {
    "orderId": {
      "type": "string",
      "description": "Unique identifier for the order"
    },
    "customer": {
      "type": "object",
      "properties": {
        "customerId": {
          "type": "string",
          "description": "Unique identifier for the customer"
        },
        "name": {
          "type": "string",
          "description": "Customer's full name"
        },
        "email": {
          "type": "string",
          "format": "email",
          "description": "Customer's email address"
        },
        "address": {
          "type": "object",
          "properties": {
            "street": { "type": "string" },
            "city": { "type": "string" },
            "state": { "type": "string" },
            "postalCode": { "type": "string" },
            "country": { "type": "string" }
          },
          "required": ["street", "city", "state", "postalCode", "country"]
        }
      },
      "required": ["customerId", "name", "email", "address"]
    },
    "orderItems": {
      "type": "array",
      "description": "List of items in the order",
      "items": {
        "type": "object",
        "properties": {
          "productId": { "type": "string", "description": "Unique product identifier" },
          "productName": { "type": "string", "description": "Name of the product" },
          "quantity": { "type": "integer", "minimum": 1 },
          "price": { "type": "number", "minimum": 0 }
        },
        "required": ["productId", "productName", "quantity", "price"]
      }
    },
    "orderDate": {
      "type": "string",
      "format": "date-time",
      "description": "The date and time the order was placed"
    },
    "payment": {
      "type": "object",
      "properties": {
        "method": {
          "type": "string",
          "enum": ["credit_card", "paypal", "bank_transfer"],
          "description": "Payment method used"
        },
        "transactionId": {
          "type": "string",
          "description": "Payment transaction identifier"
        }
      },
      "required": ["method", "transactionId"]
    },
    "totalAmount": {
      "type": "number",
      "minimum": 0,
      "description": "Total amount for the order"
    }
  },
  "required": ["orderId", "customer", "orderItems", "orderDate", "payment", "totalAmount"]
}